{
  "$schema": "../schema/BswM.schema.json",
  "module": "BswM",
  "ruleCountDoc": [
    "既存 8 ルール + Dcm_CommunicationModeType（[SWS_Dcm_00981]）の全 12 通り",
    "それぞれに対応する BSWM_ACTION_DCM_COMM_APPLY ルールを 1 行ずつ追加。"
  ],
  "osTaskIdSection": [
    "Os タスク ID（Os.json のタスクの名前から生成する。値は Os のタスク ID と同じ）"
  ],
  "osTasks": [
    {
      "task": "Can_MainFunction_Read",
      "symbol": "CAN_READ"
    },
    {
      "task": "CanTp_MainFunction",
      "symbol": "CANTP_MAIN"
    },
    {
      "task": "Rte_ScheduleRunnables",
      "symbol": "RTE_ENGINE"
    },
    {
      "task": "Rte_ScheduleWarningIndicator",
      "symbol": "RTE_WARNING"
    },
    {
      "task": "CanSM_MainFunction",
      "symbol": "CANSM_MAIN"
    },
    {
      "task": "Com_MainFunctionRx",
      "symbol": "COM_MAIN"
    },
    {
      "task": "Com_MainFunctionTx",
      "symbol": "COM_MAIN_TX",
      "note": [
        "Com_MainFunctionTx は Com_MainFunctionRx の直後に挿入した",
        "（2026-08、単体だった Com_MainFunction を実仕様準拠の Rx/Tx へ分割した際に",
        "新設）。SecOC_MainFunctionTxが同一 Os_SchedulerStep() パス内で",
        "Com のディスパッチ結果（SecOC_TxPending[]）を同じティックで拾えるように、",
        "末尾ではなくここへ挿入し、それ以降のタスクを全て 1 つずつ後ろへずらした",
        "（/code-review で「末尾に追加すると SecOC より後に実行され、1 ティック分",
        "余計な遅延が生じる」と指摘され是正）。"
      ]
    },
    {
      "task": "IoHwAb_MainFunction",
      "symbol": "IOHWAB_MAIN"
    },
    {
      "task": "WdgM_MainFunction",
      "symbol": "WDGM_MAIN"
    },
    {
      "task": "Dcm_MainFunction",
      "symbol": "DCM_MAIN"
    },
    {
      "task": "FiM_MainFunction",
      "symbol": "FIM_MAIN"
    },
    {
      "task": "CanNm_MainFunction",
      "symbol": "CANNM_MAIN"
    },
    {
      "task": "NvM_MainFunction",
      "symbol": "NVM_MAIN"
    },
    {
      "task": "Can_MainFunction_Write",
      "symbol": "CAN_TX_CONF"
    },
    {
      "task": "Can_MainFunction_BusOff",
      "symbol": "CAN_BUSOFF"
    },
    {
      "task": "Can_MainFunction_Wakeup",
      "symbol": "CAN_WAKEUP"
    },
    {
      "task": "SecOC_MainFunctionTx",
      "symbol": "SECOC_MAIN"
    },
    {
      "task": "MemIf_MainFunction",
      "symbol": "MEMIF_MAIN"
    }
  ],
  "excludedOsTasks": [
    "App_GptDemo_Run",
    "ComM_MainFunction",
    "SecOC_MainFunctionRx",
    "App_TestMsg_Run"
  ],
  "osTaskExcludedNote": [
    "次の Os のタスクは意図的に BswM の制御対象外（excludedOsTasks）のため、BswM 用のタスク ID 定数を持たない。",
    "Os.json のタスク表に載るタスクは、osTasks か excludedOsTasks のどちらかに必ず挙げる（挙げ忘れは生成時にエラーになる）。"
  ],
  "maskSection": [
    "タスクビットマスク (1ビット = 1タスク; ビット位置 = タスク ID)",
    "タスク数が 16 を超えるため uint32 を使用する（BswM_PBCfg.h の",
    "BswM_RuleType.TaskMask 参照。SecOC_MainFunctionTx",
    "の追加時に uint16 では 16 番目のビットを表現できず、いかなる BswM ルールからも",
    "制御不能になっていたバグを修正した経緯がある）。"
  ],
  "maskAll": {
    "doc": [
      "全タスク（osTasks に挙げたタスクすべて）。挙げていない Os のタスクは意図的に除外している——上記の注記参照。"
    ]
  },
  "maskApp": {
    "tasks": [
      "RTE_ENGINE",
      "RTE_WARNING"
    ],
    "doc": [
      "アプリ Runnable タスク: RTE_ENGINE + RTE_WARNING",
      " POST_RUN 時に停止し、アプリロジックを凍結する"
    ]
  },
  "maskBsw": {
    "doc": [
      "BSW タスク = ALL & ~APP (後処理・診断・CAN 受信を継続するため残す)"
    ]
  },
  "maskShutdown": {
    "keepTasks": [
      "WDGM_MAIN",
      "CAN_READ",
      "CAN_WAKEUP",
      "CANSM_MAIN",
      "NVM_MAIN",
      "MEMIF_MAIN",
      "CANNM_MAIN"
    ],
    "doc": [
      "SHUTDOWN 時に停止するタスク = ALL & ~(keepTasks に挙げたタスク)。keepTasks は次のとおり。",
      "WDGM_MAIN・CAN_READ・CAN_WAKEUP・CANSM_MAIN・NVM_MAIN・MEMIF_MAIN・CANNM_MAIN。",
      "",
      "WdgM_MainFunction は SHUTDOWN 後も動かし続ける必要がある。",
      "Renesas RA の IWDT は一度有効化すると無効化する手段がなく",
      "(Wdg_Hw.cpp 参照)、誰もリフレッシュしなければ SHUTDOWN 後も",
      "HW タイムアウトで MCU がリセットされてしまう",
      "(WdgM_SupervisionSuppressed が立っているため、WdgM_MainFunction さえ動いていれば",
      "無条件にリフレッシュを継続し、実害なく HW を満たし続けられる)。",
      "",
      "Can_MainFunction_Read・Can_MainFunction_Wakeup も同様に SHUTDOWN 中",
      "動かし続ける必要がある。CAN 受信自体は真のハードウェア割り込み",
      "(Can_Isr()) のため BswM のタスク無効化に関わらず常に起動するが、",
      "ペンディングフラグの実処理（SPI 読み出し・CanIf 通知）はこの 2 つの",
      "タスクに委譲しているため、無効化してしまうとウェイクアップ検出も",
      "ウェイクアップ検証用フレームの受信処理も止まってしまう",
      "（ComM の NO_COM 要求で CAN コントローラを実際にスリープさせた場合",
      "（ボランタリスリープ）、バス活動によるウェイクアップ検出、および",
      "ウェイクアップ検証中に届く診断フレームの受信処理は、この 2 つの",
      "タスクだけが担う。詳細は Can.c を参照）。",
      "Can_MainFunction_BusOff は SHUTDOWN 中（CAN コントローラは SLEEP か",
      "Listen-Only）は判定条件 (CanState==CAN_CS_STARTED) が成立せず実質的に",
      "無意味なため、他の BSW タスクと同様に停止してよい。",
      "",
      "CanSM_MainFunction も SHUTDOWN 中動かし続ける必要がある。ウェイクアップ",
      "検証（CANSM_STATE_WAKEUP_VALIDATING、AUTOSAR EcuM Wakeup Validation",
      "Protocol 相当）の検証タイムアウトを監視できるのがこのタスクだけのため",
      "（詳細は CanSM.c を参照）。",
      "",
      "NvM_MainFunction も SHUTDOWN 中動かし続ける必要がある。SHUTDOWN へ",
      "遷移する直前に Dem が新規 DTC を確定して NvM_WriteBlock() の書き込み",
      "ジョブが保留中のまま残っている可能性があり、このタスクを止めてしまうと",
      "次に RUN へ戻るまで（あるいは戻らないまま）EEPROM への永続化が完了しない。",
      "",
      "MemIf_MainFunction も同じ理由で動かし続ける必要がある。NvM_MainFunction は",
      "MemIf_Write() でジョブを「開始」するだけで、実際の物理バイト書き込みを",
      "1 バイトずつ進めるのは MemIf_MainFunction（Fee 経由）である。",
      "NvM_MainFunction だけを SHUTDOWN 中も動かして MemIf_MainFunction を",
      "止めてしまうと、NvM がジョブを開始したまま永久に MEMIF_JOB_PENDING を",
      "待ち続け、EEPROM への永続化が完了しない（詳細は NvM.c / MemIf.c を参照）。",
      "",
      "CanNm_MainFunction も SHUTDOWN 中動かし続ける必要がある。CanSM の実物理",
      "スリープ（Can_SetControllerMode(CAN_T_SLEEP)）は CanNm が Bus-Sleep Mode へ",
      "到達した通知（ComM_Nm_BusSleepMode() 経由で CanSM_RequestComMode(NO_COM)",
      "が呼ばれる）を受けて初めて行われる設計（協調スリープ、CanNm.c/ComM.c/",
      "CanSM.c 参照）に変更したため、CanNm の状態機械タイマ",
      "（Prepare Bus-Sleep Mode の Wait-Bus-Sleep Timer 等）がここで停止すると",
      "CanNm が Bus-Sleep Mode へ二度と到達できず、CAN コントローラが永久に",
      "物理スリープしなくなる。また Bus-Sleep/Prepare Bus-Sleep 中に他ノードの",
      "NM フレームを受信して Repeat Message State へ戻った場合も、その後の",
      "周期送信・状態遷移判定は本タスクの中でしか行われないため、これを止めると",
      "CanNm がその状態に永久に固着してしまう（実機で確認された不具合）。",
      "",
      "SecOC_MainFunctionTx はこの「動かし続ける」リストに含まれない",
      "（Com_MainFunctionTx 等と同様、SHUTDOWN 中は停止してよいタスクの扱い。",
      "SHUTDOWN 中は Com_MainFunctionTx 自体が停止して SecOC_TxPending[] を",
      "誰も立てなくなるため送信要求は発生しないが、無効化しておくのが本来の",
      "設計意図であり、BSWM_TASK_MASK_ALL に BSWM_OS_TASK_SECOC_MAIN のビットを",
      "含めることでこの無効化対象に含める）。"
    ]
  },
  "rules": [
    {
      "comment": [
        "Rule 0: EcuM → RUN: 全タスクを有効化"
      ],
      "operator": "AND",
      "conditions": [
        {
          "source": "ECUM",
          "value": "ECUM_STATE_RUN"
        }
      ],
      "action": "ACTIVATE",
      "taskMask": "BSWM_TASK_MASK_ALL"
    },
    {
      "comment": [
        "Rule 1: EcuM → POST_RUN: アプリ Runnable のみ無効化 (BSW は継続)"
      ],
      "operator": "AND",
      "conditions": [
        {
          "source": "ECUM",
          "value": "ECUM_STATE_POST_RUN"
        }
      ],
      "action": "DEACTIVATE",
      "taskMask": "BSWM_TASK_MASK_APP"
    },
    {
      "comment": [
        "Rule 2: EcuM → SHUTDOWN: WdgM_MainFunction・Can_MainFunction_Read・",
        "Can_MainFunction_Wakeup・CanSM_MainFunction・NvM_MainFunction・",
        "MemIf_MainFunction・CanNm_MainFunction 以外を無効化"
      ],
      "operator": "AND",
      "conditions": [
        {
          "source": "ECUM",
          "value": "ECUM_STATE_SHUTDOWN"
        }
      ],
      "action": "DEACTIVATE",
      "taskMask": "BSWM_TASK_MASK_SHUTDOWN"
    },
    {
      "comment": [
        "Rule 3: EcuM==RUN AND ComM==FULL_COMMUNICATION: I-PDU Group「テレメトリ」を起動",
        "（initialize=false: POST_RUN/SILENT_COM 等で停止する前の直近の値・",
        "カウンタをそのまま引き継いで再開する。起動直後の初回だけは Com_Init()",
        "自体が既に初期値でゼロクリア済みのため、initialize=false でも実害はない）"
      ],
      "operator": "AND",
      "conditions": [
        {
          "source": "ECUM",
          "value": "ECUM_STATE_RUN"
        },
        {
          "source": "COMM",
          "value": "COMM_FULL_COMMUNICATION"
        }
      ],
      "action": "PDU_GROUP_START",
      "ipduGroup": "COM_IPDU_GROUP_TELEMETRY",
      "initialize": false
    },
    {
      "comment": [
        "Rule 4: EcuM → POST_RUN: I-PDU Group「テレメトリ」を停止"
      ],
      "operator": "AND",
      "conditions": [
        {
          "source": "ECUM",
          "value": "ECUM_STATE_POST_RUN"
        }
      ],
      "action": "PDU_GROUP_STOP",
      "ipduGroup": "COM_IPDU_GROUP_TELEMETRY"
    },
    {
      "comment": [
        "Rule 5: ComM==SILENT_COMMUNICATION OR ComM==NO_COMMUNICATION:",
        "I-PDU Group「テレメトリ」を停止（Rule3 の AND 条件と対になる OR 条件。",
        "EcuM が RUN のままでも CAN チャネルが FULL_COMMUNICATION から離脱したら",
        "（Bus-Off 中の SILENT_COM、ボランタリスリープの NO_COM いずれでも）",
        "即座にテレメトリ送信を止める）"
      ],
      "operator": "OR",
      "conditions": [
        {
          "source": "COMM",
          "value": "COMM_SILENT_COMMUNICATION"
        },
        {
          "source": "COMM",
          "value": "COMM_NO_COMMUNICATION"
        }
      ],
      "action": "PDU_GROUP_STOP",
      "ipduGroup": "COM_IPDU_GROUP_TELEMETRY"
    },
    {
      "comment": [
        "Rule 6/7: I-PDU Group「センサーRX」(EngineInfo/AbsInfo) の起動/停止",
        "（2026-08 追加）。狙い・Rule 3/4/5（テレメトリ、TX）との条件の違い",
        "（SILENT_COMMUNICATION/POST_RUN を対象外にした理由）は、本ファイル",
        "冒頭の「Rule 6/7 の狙い」コメント参照。",
        "Rule 6: EcuM==RUN AND ComM==FULL_COMMUNICATION: I-PDU Group「センサーRX」を起動"
      ],
      "operator": "AND",
      "conditions": [
        {
          "source": "ECUM",
          "value": "ECUM_STATE_RUN"
        },
        {
          "source": "COMM",
          "value": "COMM_FULL_COMMUNICATION"
        }
      ],
      "action": "PDU_GROUP_START",
      "ipduGroup": "COM_IPDU_GROUP_SENSOR_RX",
      "initialize": false
    },
    {
      "comment": [
        "Rule 7: ComM==NO_COMMUNICATION（真の物理スリープのみ。",
        "SILENT_COMMUNICATION は対象外——上のコメント参照）:",
        "I-PDU Group「センサーRX」を停止"
      ],
      "operator": "AND",
      "conditions": [
        {
          "source": "COMM",
          "value": "COMM_NO_COMMUNICATION"
        }
      ],
      "action": "PDU_GROUP_STOP",
      "ipduGroup": "COM_IPDU_GROUP_SENSOR_RX"